{
  "$schema": "https://json-schema.org/draft/2020-12/schema",
  "$id": "delta.schema.json",
  "title": "Extract update delta (ARD §6.2)",
  "type": "object",
  "additionalProperties": false,
  "required": ["add_nodes", "add_edges", "enrich_nodes", "flag_removed"],
  "properties": {
    "add_nodes": {
      "type": "array",
      "items": {
        "oneOf": [
          {
            "type": "object", "additionalProperties": false,
            "required": ["key", "type", "label", "description", "actor", "icom", "subprocess"],
            "properties": {
              "key": { "type": "string" },
              "type": { "const": "activity" },
              "label": { "type": "string" }, "description": { "type": "string" },
              "actor": { "type": "string" },
              "icom": { "$ref": "#/$defs/icom" },
              "subprocess": { "type": "null" }
            }
          },
          {
            "type": "object", "additionalProperties": false,
            "required": ["key", "type", "junctionType", "direction"],
            "properties": {
              "key": { "type": "string" },
              "type": { "const": "junction" },
              "junctionType": { "enum": ["AND", "OR", "XOR"] },
              "direction": { "enum": ["split", "join"] }
            }
          }
        ]
      }
    },
    "add_edges": {
      "type": "array",
      "items": {
        "type": "object", "additionalProperties": false,
        "required": ["from", "to"],
        "properties": {
          "from": { "type": "string" }, "to": { "type": "string" }, "label": { "type": "string" }
        }
      }
    },
    "enrich_nodes": {
      "type": "array",
      "items": {
        "type": "object", "additionalProperties": false,
        "required": ["id", "set"],
        "properties": {
          "id": { "type": "string" },
          "set": { "type": "object" }
        }
      }
    },
    "flag_removed": {
      "type": "array",
      "items": {
        "type": "object", "additionalProperties": false,
        "required": ["id"],
        "properties": { "id": { "type": "string" } }
      }
    },
    "add_subprocesses": {
      "type": "array",
      "items": {
        "type": "object", "additionalProperties": false,
        "required": ["parent", "process"],
        "properties": {
          "parent": { "type": "string" },
          "process": { "$ref": "#/$defs/candidateNoSub" }
        }
      }
    },
    "remove_edges": {
      "type": "array",
      "items": {
        "type": "object", "additionalProperties": false,
        "required": ["from", "to"],
        "properties": { "from": { "type": "string" }, "to": { "type": "string" } }
      }
    },
    "revise_nodes": {
      "type": "array",
      "items": {
        "type": "object", "additionalProperties": false,
        "required": ["id", "set"],
        "properties": { "id": { "type": "string" }, "set": { "type": "object" } }
      }
    },
    "set_process": {
      "type": "object", "additionalProperties": false, "minProperties": 1,
      "properties": {
        "name": { "type": "string" },
        "summary": { "type": "string" },
        "idef0": { "$ref": "#/$defs/icom" },
        "kpis": { "type": "array", "items": { "$ref": "#/$defs/kpi" } }
      }
    }
  },
  "$defs": {
    "icom": {
      "type": "object", "additionalProperties": false,
      "required": ["inputs", "controls", "outputs", "mechanisms"],
      "properties": {
        "inputs": { "type": "array", "items": { "type": "string" } },
        "controls": { "type": "array", "items": { "type": "string" } },
        "outputs": { "type": "array", "items": { "type": "string" } },
        "mechanisms": { "type": "array", "items": { "type": "string" } }
      }
    },
    "candidateNoSub": {
      "type": "object", "additionalProperties": false,
      "required": ["department", "process_name", "summary", "idef0", "kpis", "nodes", "edges"],
      "properties": {
        "department": { "type": "string", "pattern": "^[a-z]+$" },
        "process_name": { "type": "string" },
        "summary": { "type": "string" },
        "idef0": { "$ref": "#/$defs/icom" },
        "kpis": { "type": "array", "items": { "$ref": "#/$defs/kpi" } },
        "nodes": { "type": "array", "items": { "$ref": "#/$defs/node" } },
        "edges": { "type": "array", "items": { "$ref": "#/$defs/edge" } }
      }
    },
    "node": {
      "oneOf": [
        {
          "type": "object", "additionalProperties": false,
          "required": ["key", "type", "label", "description", "actor", "icom", "subprocess"],
          "properties": {
            "key": { "type": "string" },
            "type": { "const": "activity" },
            "label": { "type": "string" },
            "description": { "type": "string" },
            "actor": { "type": "string" },
            "icom": { "$ref": "#/$defs/icom" },
            "subprocess": { "type": "null" }
          }
        },
        {
          "type": "object", "additionalProperties": false,
          "required": ["key", "type", "junctionType", "direction"],
          "properties": {
            "key": { "type": "string" },
            "type": { "const": "junction" },
            "junctionType": { "enum": ["AND", "OR", "XOR"] },
            "direction": { "enum": ["split", "join"] }
          }
        }
      ]
    },
    "edge": {
      "type": "object", "additionalProperties": false,
      "required": ["from", "to"],
      "properties": {
        "from": { "type": "string" }, "to": { "type": "string" }, "label": { "type": "string" }
      }
    },
    "kpi": {
      "type": "object", "additionalProperties": false,
      "required": ["name"],
      "properties": {
        "name": { "type": "string" }, "definition": { "type": "string" },
        "target": { "type": "string" }, "unit": { "type": "string" }
      }
    }
  }
}
